{
    "$schema": "http://json-schema.org/draft-07/schema#",
    "title": "MQOrder",
    "type": "object",
    "properties": {
      "id": {
        "type": "string",
        "format": "uuid"
      },
      "customer": {
        "type": "object",
        "properties": {
          "id": {
            "type": "string",
            "format": "uuid"
          },
          "name": {
            "type": "object",
            "properties": {
              "firstname": {
                "type": "string"
              },
              "lastname": {
                "type": "string"
              }
            },
            "required": [
              "lastname"
            ]
          },
          "phone": {
            "type": "object",
            "properties": {
              "type": {
                "type": "string"
              },
              "number": {
                "type": "string"
              }
            },
            "required": [
              "type",
              "number"
            ]
          }
        },
        "required": [
          "id",
          "name",
          "phone"
        ]
      },
      "creditcard": {
        "type": "object",
        "properties": {
          "number": {
            "type": "string"
          },
          "expiry": {
            "type": "string"
          }
        },
        "required": [
          "number",
          "expiry"
        ]
      },
      "products": {
        "type": "array",
        "items": [
          {
            "type": "object",
            "properties": {
              "id": {
                "type": "string",
                "format": "uuid"
              },
              "description": {
                "type": "string"
              },
              "cost": {
                "type": "number"
              },
              "quantity": {
                "type": "integer"
              }
            },
            "required": [
              "id",
              "description",
              "cost",
              "quantity"
            ]
          }
        ]
      },
      "ordertime": {
        "type": "string",
        "pattern": "^\\d{4}-\\d{2}-\\d{2} \\d{2}:\\d{2}:\\d{2}\\.\\d{1,3}$"
      }
    },
    "required": [
      "id",
      "customer",
      "products",
      "ordertime"
    ]
}